{
  "acceptedTraceVersion": "compute-milestone-1-v1",
  "toolSchemaVersion": "compute-tools-v1",
  "traceEquivalenceVersion": "trace-eq-v1",
  "tasks": [
    {
      "taskId": "compute.single.spec.001",
      "acceptedTraces": [
        {
          "responseType": "final_answer",
          "steps": [
            {"toolCalls": [{"name": "get_instance_spec", "arguments": {"instanceType": "p5.48xlarge"}}]}
          ]
        }
      ]
    },
    {
      "taskId": "compute.single.price.002",
      "acceptedTraces": [
        {
          "responseType": "final_answer",
          "steps": [
            {"toolCalls": [{"name": "get_instance_price", "arguments": {"instanceType": "g7e.2xlarge"}}]}
          ]
        }
      ]
    },
    {
      "taskId": "compute.single.fit.003",
      "acceptedTraces": [
        {
          "responseType": "final_answer",
          "steps": [
            {"toolCalls": [{"name": "check_model_fit", "arguments": {"instanceType": "g6e.xlarge", "modelBillionParameters": 34, "precision": "fp8", "mode": "inference"}}]}
          ]
        }
      ]
    },
    {
      "taskId": "compute.single.search.004",
      "acceptedTraces": [
        {
          "responseType": "final_answer",
          "steps": [
            {"toolCalls": [{"name": "search_instances", "arguments": {"workload": "llm_inference", "minAcceleratorMemoryGib": 90}}]}
          ]
        }
      ]
    },
    {
      "taskId": "compute.single.recommend.005",
      "acceptedTraces": [
        {
          "responseType": "final_answer",
          "steps": [
            {"toolCalls": [{"name": "recommend_instance", "arguments": {"candidateInstanceTypes": ["g6e.xlarge", "g7e.2xlarge"], "modelBillionParameters": 34, "precision": "fp8", "mode": "inference", "optimizeFor": "cheapest"}}]}
          ]
        }
      ]
    },
    {
      "taskId": "compute.seq.search-recommend.001",
      "acceptedTraces": [
        {
          "responseType": "final_answer",
          "steps": [
            {"toolCalls": [{"name": "search_instances", "arguments": {"workload": "fine_tuning", "minAcceleratorMemoryGib": 560, "maxMonthlyCostCents": 2000000, "requireEfa": true}}]},
            {"toolCalls": [{"name": "recommend_instance", "arguments": {"candidateInstanceTypes": ["trn2.48xlarge"], "modelBillionParameters": 70, "precision": "bf16", "mode": "fine_tuning", "maxMonthlyCostCents": 2000000, "requireEfa": true, "optimizeFor": "cheapest"}}]}
          ]
        }
      ]
    },
    {
      "taskId": "compute.seq.spec-fit-price.002",
      "acceptedTraces": [
        {
          "responseType": "final_answer",
          "steps": [
            {"toolCalls": [{"name": "get_instance_spec", "arguments": {"instanceType": "g6e.12xlarge"}}]},
            {"toolCalls": [{"name": "check_model_fit", "arguments": {"instanceType": "g6e.12xlarge", "modelBillionParameters": 70, "precision": "bf16", "mode": "inference"}}]},
            {"toolCalls": [{"name": "get_instance_price", "arguments": {"instanceType": "g6e.12xlarge"}}]}
          ]
        }
      ]
    },
    {
      "taskId": "compute.seq.search-price-recommend.003",
      "acceptedTraces": [
        {
          "responseType": "final_answer",
          "steps": [
            {"toolCalls": [{"name": "search_instances", "arguments": {"workload": "llm_inference", "minAcceleratorMemoryGib": 160}}]},
            {"toolCalls": [{"name": "get_instance_price", "arguments": {"instanceType": "g6e.12xlarge"}}]},
            {"toolCalls": [{"name": "recommend_instance", "arguments": {"candidateInstanceTypes": ["g6e.12xlarge", "g7e.24xlarge", "p5.48xlarge", "p5e.48xlarge"], "modelBillionParameters": 70, "precision": "bf16", "mode": "inference", "optimizeFor": "cheapest"}}]}
          ]
        }
      ]
    },
    {
      "taskId": "compute.seq.p5e-fit.004",
      "acceptedTraces": [
        {
          "responseType": "final_answer",
          "steps": [
            {"toolCalls": [{"name": "get_instance_spec", "arguments": {"instanceType": "p5e.48xlarge"}}]},
            {"toolCalls": [{"name": "check_model_fit", "arguments": {"instanceType": "p5e.48xlarge", "modelBillionParameters": 140, "precision": "bf16", "mode": "fine_tuning"}}]},
            {"toolCalls": [{"name": "get_instance_price", "arguments": {"instanceType": "p5e.48xlarge"}}]}
          ]
        }
      ]
    },
    {
      "taskId": "compute.seq.budget-bound.005",
      "acceptedTraces": [
        {
          "responseType": "final_answer",
          "steps": [
            {"toolCalls": [{"name": "search_instances", "arguments": {"workload": "fine_tuning", "minAcceleratorMemoryGib": 560, "maxMonthlyCostCents": 2000000, "requireEfa": true}}]},
            {"toolCalls": [{"name": "recommend_instance", "arguments": {"candidateInstanceTypes": ["trn2.48xlarge"], "modelBillionParameters": 70, "precision": "bf16", "mode": "fine_tuning", "maxMonthlyCostCents": 2000000, "requireEfa": true, "optimizeFor": "cheapest"}}]}
          ]
        }
      ]
    },
    {
      "taskId": "compute.parallel.specs.001",
      "acceptedTraces": [
        {
          "responseType": "final_answer",
          "steps": [
            {"toolCalls": [
              {"name": "get_instance_spec", "arguments": {"instanceType": "p5.48xlarge"}},
              {"name": "get_instance_spec", "arguments": {"instanceType": "p5e.48xlarge"}}
            ]},
            {"toolCalls": [
              {"name": "get_instance_price", "arguments": {"instanceType": "p5.48xlarge"}},
              {"name": "get_instance_price", "arguments": {"instanceType": "p5e.48xlarge"}}
            ]}
          ]
        }
      ]
    },
    {
      "taskId": "compute.parallel.fit.002",
      "acceptedTraces": [
        {
          "responseType": "final_answer",
          "steps": [
            {"toolCalls": [
              {"name": "check_model_fit", "arguments": {"instanceType": "g6e.12xlarge", "modelBillionParameters": 70, "precision": "bf16", "mode": "inference"}},
              {"name": "check_model_fit", "arguments": {"instanceType": "g7e.24xlarge", "modelBillionParameters": 70, "precision": "bf16", "mode": "inference"}}
            ]},
            {"toolCalls": [{"name": "recommend_instance", "arguments": {"candidateInstanceTypes": ["g6e.12xlarge", "g7e.24xlarge"], "modelBillionParameters": 70, "precision": "bf16", "mode": "inference", "optimizeFor": "cheapest"}}]}
          ]
        }
      ]
    },
    {
      "taskId": "compute.parallel.price.003",
      "acceptedTraces": [
        {
          "responseType": "final_answer",
          "steps": [
            {"toolCalls": [
              {"name": "get_instance_price", "arguments": {"instanceType": "g6e.xlarge"}},
              {"name": "get_instance_price", "arguments": {"instanceType": "g7e.2xlarge"}}
            ]},
            {"toolCalls": [{"name": "recommend_instance", "arguments": {"candidateInstanceTypes": ["g6e.xlarge", "g7e.2xlarge"], "modelBillionParameters": 34, "precision": "fp8", "mode": "inference", "optimizeFor": "cheapest"}}]}
          ]
        }
      ]
    },
    {
      "taskId": "compute.parallel.memory-price.004",
      "acceptedTraces": [
        {
          "responseType": "final_answer",
          "steps": [
            {"toolCalls": [
              {"name": "get_instance_spec", "arguments": {"instanceType": "g7e.24xlarge"}},
              {"name": "get_instance_spec", "arguments": {"instanceType": "p5.48xlarge"}}
            ]},
            {"toolCalls": [
              {"name": "get_instance_price", "arguments": {"instanceType": "g7e.24xlarge"}},
              {"name": "get_instance_price", "arguments": {"instanceType": "p5.48xlarge"}}
            ]}
          ]
        }
      ]
    },
    {
      "taskId": "compute.parallel.large-fit.005",
      "acceptedTraces": [
        {
          "responseType": "final_answer",
          "steps": [
            {"toolCalls": [
              {"name": "check_model_fit", "arguments": {"instanceType": "p5.48xlarge", "modelBillionParameters": 140, "precision": "bf16", "mode": "fine_tuning"}},
              {"name": "check_model_fit", "arguments": {"instanceType": "p5e.48xlarge", "modelBillionParameters": 140, "precision": "bf16", "mode": "fine_tuning"}}
            ]},
            {"toolCalls": [{"name": "recommend_instance", "arguments": {"candidateInstanceTypes": ["p5.48xlarge", "p5e.48xlarge"], "modelBillionParameters": 140, "precision": "bf16", "mode": "fine_tuning", "optimizeFor": "most_memory"}}]}
          ]
        }
      ]
    },
    {
      "taskId": "compute.mixed-dag.fit-price-recommend.001",
      "acceptedTraces": [
        {
          "responseType": "final_answer",
          "steps": [
            {"toolCalls": [
              {"name": "get_instance_spec", "arguments": {"instanceType": "p5.48xlarge"}},
              {"name": "get_instance_spec", "arguments": {"instanceType": "p5e.48xlarge"}}
            ]},
            {"toolCalls": [
              {"name": "check_model_fit", "arguments": {"instanceType": "p5.48xlarge", "modelBillionParameters": 70, "precision": "bf16", "mode": "fine_tuning"}},
              {"name": "check_model_fit", "arguments": {"instanceType": "p5e.48xlarge", "modelBillionParameters": 70, "precision": "bf16", "mode": "fine_tuning"}}
            ]},
            {"toolCalls": [
              {"name": "get_instance_price", "arguments": {"instanceType": "p5.48xlarge"}},
              {"name": "get_instance_price", "arguments": {"instanceType": "p5e.48xlarge"}}
            ]},
            {"toolCalls": [{"name": "recommend_instance", "arguments": {"candidateInstanceTypes": ["p5.48xlarge", "p5e.48xlarge"], "modelBillionParameters": 70, "precision": "bf16", "mode": "fine_tuning", "optimizeFor": "cheapest"}}]}
          ]
        }
      ]
    },
    {
      "taskId": "compute.state.budget.001",
      "acceptedTraces": [
        {
          "responseType": "final_answer",
          "steps": [